{
  "version": "1.2",
  "generatedAt": "2026-09-30T08:25:53.997Z",
  "callers": {
    "nodes": [
      {
        "scopeId": "src/entities/construction-showcase.entity.ts:146:40",
        "name": "runConstructionShowcase",
        "kind": "function",
        "filePath": "src/entities/construction-showcase.entity.ts",
        "location": "src/entities/construction-showcase.entity.ts:146:40",
        "starter": true
      },
      {
        "scopeId": "src/main.ts",
        "name": "src/main.ts",
        "kind": "module",
        "filePath": "src/main.ts",
        "location": "src/main.ts:1:1",
        "starter": true
      },
      {
        "scopeId": "src/app.module.ts",
        "name": "src/app.module.ts",
        "kind": "module",
        "filePath": "src/app.module.ts",
        "location": "src/app.module.ts:1:1",
        "starter": false
      },
      {
        "scopeId": "src/user.controller.ts",
        "name": "src/user.controller.ts",
        "kind": "module",
        "filePath": "src/user.controller.ts",
        "location": "src/user.controller.ts:1:1",
        "starter": false
      },
      {
        "scopeId": "src/user.controller.ts:41:2",
        "name": "UserController.createUser",
        "kind": "method",
        "filePath": "src/user.controller.ts",
        "location": "src/user.controller.ts:41:2",
        "starter": false
      }
    ],
    "edges": [
      {
        "caller": "src/user.controller.ts",
        "callee": "src/user.controller.ts:41:2"
      },
      {
        "caller": "src/app.module.ts",
        "callee": "src/user.controller.ts"
      },
      {
        "caller": "src/main.ts",
        "callee": "src/app.module.ts"
      },
      {
        "caller": "src/app.module.ts",
        "callee": "src/user.controller.ts:41:2"
      }
    ],
    "anchors": [
      {
        "location": "src/user.controller.ts:55:16",
        "holderScopeId": "src/user.controller.ts:41:2",
        "typePath": "UserEntity",
        "constructorText": "UserEntity",
        "variable": "user"
      },
      {
        "location": "src/entities/construction-showcase.entity.ts:178:23",
        "holderScopeId": "src/entities/construction-showcase.entity.ts:146:40",
        "typePath": "UserEntity",
        "constructorText": "UserEntity",
        "variable": "showcaseUser"
      }
    ]
  },
  "points": [
    {
      "kind": "pipe",
      "className": "ValidationPipe",
      "location": "src/user.controller.ts:49:2",
      "code": "@UsePipes(new ValidationPipe({ transform: true }))",
      "scope": "method:UserController.createUser",
      "targets": [
        "UserController"
      ]
    },
    {
      "kind": "interceptor",
      "className": "MarkInterceptor",
      "location": "src/mark.interceptor.ts:18:14",
      "code": "@Injectable()",
      "scope": "global",
      "targets": []
    },
    {
      "kind": "middleware",
      "className": "MidSleepMiddleware",
      "location": "src/mid-sleep.middleware.ts:39:14",
      "code": "@Injectable()",
      "scope": "module",
      "targets": [
        "chaos/mid_sleep"
      ]
    },
    {
      "kind": "filter",
      "className": "TraceExceptionFilter",
      "location": "src/trace-exception.filter.ts:95:14",
      "code": "@Catch()",
      "scope": "module",
      "targets": []
    }
  ]
}
